{
  "schema_version": 1,
  "id": "issue-1-public-build-source-baseline",
  "source": {
    "repository": "https://github.com/AzureAD/microsoft-authentication-cli",
    "commit": "de20930c34b3b86c8a0ed7bbdeeca3f662dae918",
    "build_entry_point": "AzureAuth.sln"
  },
  "stage_applicability": {
    "build": {
      "applicable": true,
      "source_references": [
        "de20930c34b3b86c8a0ed7bbdeeca3f662dae918:AzureAuth.sln#L6-L13",
        "de20930c34b3b86c8a0ed7bbdeeca3f662dae918:AzureAuth.sln#L20-L26",
        "de20930c34b3b86c8a0ed7bbdeeca3f662dae918:AzureAuth.sln#L38-L133",
        "de20930c34b3b86c8a0ed7bbdeeca3f662dae918:.azuredevops/BuildAndTest.yml#L75-L81",
        "de20930c34b3b86c8a0ed7bbdeeca3f662dae918:.azuredevops/release.yml#L140-L145",
        "de20930c34b3b86c8a0ed7bbdeeca3f662dae918:CONTRIBUTING.md#L42-L46"
      ]
    },
    "test": {
      "applicable": true,
      "source_references": [
        "de20930c34b3b86c8a0ed7bbdeeca3f662dae918:AzureAuth.sln#L8",
        "de20930c34b3b86c8a0ed7bbdeeca3f662dae918:AzureAuth.sln#L12",
        "de20930c34b3b86c8a0ed7bbdeeca3f662dae918:AzureAuth.sln#L24",
        "de20930c34b3b86c8a0ed7bbdeeca3f662dae918:src/MSALWrapper.Test/MSALWrapper.Test.csproj#L14-L18",
        "de20930c34b3b86c8a0ed7bbdeeca3f662dae918:src/AzureAuth.Test/AzureAuth.Test.csproj#L17-L23",
        "de20930c34b3b86c8a0ed7bbdeeca3f662dae918:src/AdoPat.Test/AdoPat.Test.csproj#L15-L20",
        "de20930c34b3b86c8a0ed7bbdeeca3f662dae918:.azuredevops/BuildAndTest.yml#L82-L86",
        "de20930c34b3b86c8a0ed7bbdeeca3f662dae918:.azuredevops/release.yml#L146-L150",
        "de20930c34b3b86c8a0ed7bbdeeca3f662dae918:CONTRIBUTING.md#L48-L51"
      ]
    },
    "package": {
      "applicable": true,
      "source_references": [
        "de20930c34b3b86c8a0ed7bbdeeca3f662dae918:src/MSALWrapper/MSALWrapper.csproj#L3-L7",
        "de20930c34b3b86c8a0ed7bbdeeca3f662dae918:src/AdoPat/AdoPat.csproj#L2-L6",
        "de20930c34b3b86c8a0ed7bbdeeca3f662dae918:src/AzureAuth/AzureAuth.csproj#L12-L20",
        "de20930c34b3b86c8a0ed7bbdeeca3f662dae918:src/MSALWrapper.Test/MSALWrapper.Test.csproj#L4",
        "de20930c34b3b86c8a0ed7bbdeeca3f662dae918:src/AzureAuth.Test/AzureAuth.Test.csproj#L7",
        "de20930c34b3b86c8a0ed7bbdeeca3f662dae918:src/AdoPat.Test/AdoPat.Test.csproj#L4",
        "de20930c34b3b86c8a0ed7bbdeeca3f662dae918:.azuredevops/release.yml#L326-L346",
        "de20930c34b3b86c8a0ed7bbdeeca3f662dae918:.azuredevops/release.yml#L355-L480",
        "de20930c34b3b86c8a0ed7bbdeeca3f662dae918:.azuredevops/release.yml#L482-L531"
      ]
    }
  },
  "attempted_targets": [
    {
      "id": "target-adopat-net8-0",
      "project_path": "src/AdoPat/AdoPat.csproj",
      "target_framework": "net8.0",
      "sdk": "Microsoft.NET.Sdk",
      "project_references": [],
      "source_references": [
        "de20930c34b3b86c8a0ed7bbdeeca3f662dae918:AzureAuth.sln#L22",
        "de20930c34b3b86c8a0ed7bbdeeca3f662dae918:src/AdoPat/AdoPat.csproj#L1",
        "de20930c34b3b86c8a0ed7bbdeeca3f662dae918:src/AdoPat/AdoPat.csproj#L4"
      ]
    },
    {
      "id": "target-adopat-test-net8-0",
      "project_path": "src/AdoPat.Test/AdoPat.Test.csproj",
      "target_framework": "net8.0",
      "sdk": "Microsoft.NET.Sdk",
      "project_references": [
        "target-testhelper-net8-0",
        "target-adopat-net8-0"
      ],
      "source_references": [
        "de20930c34b3b86c8a0ed7bbdeeca3f662dae918:AzureAuth.sln#L24",
        "de20930c34b3b86c8a0ed7bbdeeca3f662dae918:src/AdoPat.Test/AdoPat.Test.csproj#L1",
        "de20930c34b3b86c8a0ed7bbdeeca3f662dae918:src/AdoPat.Test/AdoPat.Test.csproj#L3",
        "de20930c34b3b86c8a0ed7bbdeeca3f662dae918:src/AdoPat.Test/AdoPat.Test.csproj#L23",
        "de20930c34b3b86c8a0ed7bbdeeca3f662dae918:src/AdoPat.Test/AdoPat.Test.csproj#L24"
      ]
    },
    {
      "id": "target-azureauth-net8-0",
      "project_path": "src/AzureAuth/AzureAuth.csproj",
      "target_framework": "net8.0",
      "sdk": "Microsoft.NET.Sdk",
      "project_references": [
        "target-msalwrapper-net8-0",
        "target-adopat-net8-0"
      ],
      "source_references": [
        "de20930c34b3b86c8a0ed7bbdeeca3f662dae918:AzureAuth.sln#L10",
        "de20930c34b3b86c8a0ed7bbdeeca3f662dae918:src/AzureAuth/AzureAuth.csproj#L1",
        "de20930c34b3b86c8a0ed7bbdeeca3f662dae918:src/AzureAuth/AzureAuth.csproj#L13",
        "de20930c34b3b86c8a0ed7bbdeeca3f662dae918:src/AzureAuth/AzureAuth.csproj#L34",
        "de20930c34b3b86c8a0ed7bbdeeca3f662dae918:src/AzureAuth/AzureAuth.csproj#L35"
      ]
    },
    {
      "id": "target-azureauth-test-net8-0",
      "project_path": "src/AzureAuth.Test/AzureAuth.Test.csproj",
      "target_framework": "net8.0",
      "sdk": "Microsoft.NET.Sdk",
      "project_references": [
        "target-azureauth-net8-0",
        "target-testhelper-net8-0"
      ],
      "source_references": [
        "de20930c34b3b86c8a0ed7bbdeeca3f662dae918:AzureAuth.sln#L12",
        "de20930c34b3b86c8a0ed7bbdeeca3f662dae918:src/AzureAuth.Test/AzureAuth.Test.csproj#L1",
        "de20930c34b3b86c8a0ed7bbdeeca3f662dae918:src/AzureAuth.Test/AzureAuth.Test.csproj#L6",
        "de20930c34b3b86c8a0ed7bbdeeca3f662dae918:src/AzureAuth.Test/AzureAuth.Test.csproj#L26",
        "de20930c34b3b86c8a0ed7bbdeeca3f662dae918:src/AzureAuth.Test/AzureAuth.Test.csproj#L27"
      ]
    },
    {
      "id": "target-msalwrapper-benchmark-net8-0",
      "project_path": "src/MSALWrapper.Benchmark/MSALWrapper.Benchmark.csproj",
      "target_framework": "net8.0",
      "sdk": "Microsoft.NET.Sdk",
      "project_references": [
        "target-msalwrapper-net8-0"
      ],
      "source_references": [
        "de20930c34b3b86c8a0ed7bbdeeca3f662dae918:AzureAuth.sln#L20",
        "de20930c34b3b86c8a0ed7bbdeeca3f662dae918:src/MSALWrapper.Benchmark/MSALWrapper.Benchmark.csproj#L1",
        "de20930c34b3b86c8a0ed7bbdeeca3f662dae918:src/MSALWrapper.Benchmark/MSALWrapper.Benchmark.csproj#L2-L3",
        "de20930c34b3b86c8a0ed7bbdeeca3f662dae918:src/MSALWrapper.Benchmark/MSALWrapper.Benchmark.csproj#L7-L8",
        "de20930c34b3b86c8a0ed7bbdeeca3f662dae918:src/MSALWrapper.Benchmark/MSALWrapper.Benchmark.csproj#L10-L11",
        "de20930c34b3b86c8a0ed7bbdeeca3f662dae918:src/MSALWrapper.Benchmark/MSALWrapper.Benchmark.csproj#L24"
      ]
    },
    {
      "id": "target-msalwrapper-net8-0",
      "project_path": "src/MSALWrapper/MSALWrapper.csproj",
      "target_framework": "net8.0",
      "sdk": "Microsoft.NET.Sdk",
      "project_references": [],
      "source_references": [
        "de20930c34b3b86c8a0ed7bbdeeca3f662dae918:AzureAuth.sln#L6",
        "de20930c34b3b86c8a0ed7bbdeeca3f662dae918:src/MSALWrapper/MSALWrapper.csproj#L1",
        "de20930c34b3b86c8a0ed7bbdeeca3f662dae918:src/MSALWrapper/MSALWrapper.csproj#L5"
      ]
    },
    {
      "id": "target-msalwrapper-test-net8-0",
      "project_path": "src/MSALWrapper.Test/MSALWrapper.Test.csproj",
      "target_framework": "net8.0",
      "sdk": "Microsoft.NET.Sdk",
      "project_references": [
        "target-testhelper-net8-0",
        "target-msalwrapper-net8-0"
      ],
      "source_references": [
        "de20930c34b3b86c8a0ed7bbdeeca3f662dae918:AzureAuth.sln#L8",
        "de20930c34b3b86c8a0ed7bbdeeca3f662dae918:src/MSALWrapper.Test/MSALWrapper.Test.csproj#L1",
        "de20930c34b3b86c8a0ed7bbdeeca3f662dae918:src/MSALWrapper.Test/MSALWrapper.Test.csproj#L3",
        "de20930c34b3b86c8a0ed7bbdeeca3f662dae918:src/MSALWrapper.Test/MSALWrapper.Test.csproj#L24",
        "de20930c34b3b86c8a0ed7bbdeeca3f662dae918:src/MSALWrapper.Test/MSALWrapper.Test.csproj#L25"
      ]
    },
    {
      "id": "target-testhelper-net8-0",
      "project_path": "src/TestHelper/TestHelper.csproj",
      "target_framework": "net8.0",
      "sdk": "Microsoft.NET.Sdk",
      "project_references": [],
      "source_references": [
        "de20930c34b3b86c8a0ed7bbdeeca3f662dae918:AzureAuth.sln#L26",
        "de20930c34b3b86c8a0ed7bbdeeca3f662dae918:src/TestHelper/TestHelper.csproj#L1",
        "de20930c34b3b86c8a0ed7bbdeeca3f662dae918:src/TestHelper/TestHelper.csproj#L3"
      ]
    }
  ],
  "package_targets": [
    {
      "target_id": "target-adopat-net8-0",
      "package_id": "Microsoft.Authentication.AdoPat",
      "source_references": [
        "de20930c34b3b86c8a0ed7bbdeeca3f662dae918:src/AdoPat/AdoPat.csproj#L2-L6"
      ]
    },
    {
      "target_id": "target-azureauth-net8-0",
      "package_id": "microsoft.authentication.azureauth",
      "source_references": [
        "de20930c34b3b86c8a0ed7bbdeeca3f662dae918:src/AzureAuth/AzureAuth.csproj#L12-L20"
      ]
    },
    {
      "target_id": "target-msalwrapper-benchmark-net8-0",
      "package_id": "MSALWrapper.Benchmark",
      "source_references": [
        "de20930c34b3b86c8a0ed7bbdeeca3f662dae918:src/MSALWrapper.Benchmark/MSALWrapper.Benchmark.csproj#L1-L18"
      ]
    },
    {
      "target_id": "target-msalwrapper-net8-0",
      "package_id": "Microsoft.Authentication.MSALWrapper",
      "source_references": [
        "de20930c34b3b86c8a0ed7bbdeeca3f662dae918:src/MSALWrapper/MSALWrapper.csproj#L3-L7"
      ]
    },
    {
      "target_id": "target-testhelper-net8-0",
      "package_id": "TestHelper",
      "source_references": [
        "de20930c34b3b86c8a0ed7bbdeeca3f662dae918:src/TestHelper/TestHelper.csproj#L1-L5"
      ]
    }
  ],
  "source_declared_direct": [
    {
      "declaration_id": "decl-adopat-test-fluentassertions",
      "id": "FluentAssertions",
      "kind": "package",
      "version_constraint": "6.1.0",
      "declaration_location": "de20930c34b3b86c8a0ed7bbdeeca3f662dae918:src/AdoPat.Test/AdoPat.Test.csproj#L15",
      "auxiliary_locations": [],
      "targets": [
        "target-adopat-test-net8-0"
      ],
      "condition": "always"
    },
    {
      "declaration_id": "decl-adopat-test-microsoft-net-test-sdk",
      "id": "Microsoft.NET.Test.Sdk",
      "kind": "package",